id,code,title,attachment_file_name,attachment_content_type,attachment_file_size,content_date,language_id,doc_attachment_type_id,inactive,creator_id,published_date,original_url,original_id
876,PF91,"Application for permission to issue a writ of possession (rule 83.13)",pf091-eng.doc,application/msword,26112,04/2016,8,1,false,1,2017-03-17,GetForm.do?court_forms_id=,876
877,PF97,"QB order for sale by an Enforcement Officer by private contract",pf097-eng.doc,application/msword,23040,04/2004,8,1,false,1,2017-03-17,GetForm.do?court_forms_id=,877
896,PRA Form,"PRA form to be completed for a private room appointment before a Queen's Bench Master",pra-eng-20160115.doc,application/msword,59904,01/2016,8,1,false,1,2017-03-17,GetForm.do?court_forms_id=,896
897,PRA Cancellation Form,"Notice of cancellation of a private room appointment following lodging of consent order",pra-cancel-eng-20160115.doc,application/msword,39936,01/2016,8,1,false,1,2017-03-17,GetForm.do?court_forms_id=,897
898,Progress Monitoring Information Sheet,"Progress Monitoring Information Sheet",progress-monitoring-eng.doc,application/msword,19968,04/2005,8,2,false,1,2017-03-17,GetLeaflet.do?court_leaflets_id=,898
903,TCC/CM1,"Case Management Information Sheet",tcc-cm1-eng.pdf,application/pdf,93875,03/2002,8,1,false,1,2017-03-17,GetForm.do?court_forms_id=,903
905,TCC/PTR1,"Pre-trial review questionnaire",tcc-ptr1-eng.pdf,application/pdf,251643,10/2005,8,1,false,1,2017-03-17,GetForm.do?court_forms_id=,905
906,A61,"Application for an order for parental responsibility prior to adoption abroad (Section 84 Adoption and Children Act 2002)",a61-eng.pdf,application/pdf,407640,11/2016,8,1,false,1,2017-03-17,GetForm.do?court_forms_id=,906
908,5222,"Your guide to Jury Service",5222-eng.pdf,application/pdf,195958,10/2016,8,4,false,1,2017-03-17,GetLeaflet.do?court_leaflets_id=,908
914,MC100,"Make Sure You Can Pay Your Fine. (English)",mc100-eng.pdf,application/pdf,162515,12/2013,8,2,false,1,2017-03-17,GetLeaflet.do?court_leaflets_id=,914
916,EX345,"Beiliaid a Swyddogion Gorfodi",ex345-cym.pdf,application/pdf,216186,10/2007,25,2,false,1,2017-03-17,W_GetLeaflet.do?court_leaflets_id=,916
918,PA6,"Beth fydd yn digwydd yn fy nghyfweliad profiant?",pa006-cym.pdf,application/pdf,305538,08/2011,25,2,false,1,2017-03-17,W_GetLeaflet.do?court_leaflets_id=,918
919,ADM15B,"Notes for defendant - Admiralty limitation claim",adm15(b)-eng.pdf,application/pdf,42074,02/2013,8,3,false,1,2017-03-17,GetLeaflet.do?court_leaflets_id=,919
921,ADM1C,"Notes for Defendant on Replying to an Admiralty Claim Form",adm001(c)-eng.pdf,application/pdf,37856,02/2013,8,3,false,1,2017-03-17,GetLeaflet.do?court_leaflets_id=,921
929,EX342,"Yn dod i wrandawiad llys? Ambell beth y dylech ei wybod - Gwrandawiadau llys yn yr Uchel Lts a'r Llysoedd Sirol",ex342-cym.pdf,application/pdf,130063,04/2005,25,2,false,1,2017-03-17,W_GetLeaflet.do?court_leaflets_id=,929
930,FL700,"Sut gall hyn fy helpu i? Rhan 4 Deddf Cyfraith Teulu 1996",fl700-cym.pdf,application/pdf,278170,04/2016,25,2,false,1,2017-03-17,W_GetLeaflet.do?court_leaflets_id=,930
932,MC100,"Make Sure You Can Pay Your Fine. (Croatian)",mc100-hrv.pdf,application/pdf,515340,12/2013,6,2,false,1,2017-03-17,GetLeaflet.do?court_leaflets_id=,932
933,MC100,"Make Sure You Can Pay Your Fine (Greek)",mc100-gre.pdf,application/pdf,524633,12/2013,11,2,false,1,2017-03-17,GetLeaflet.do?court_leaflets_id=,933
934,MC100,"Make Sure You Can Pay Your Fine (Gujarati)",mc100-guj.pdf,application/pdf,221796,12/2013,12,2,false,1,2017-03-17,GetLeaflet.do?court_leaflets_id=,934
936,MC100,"Make Sure You Can Pay Your Fine (Hindi)",mc100-hin.pdf,application/pdf,226864,12/2013,13,2,false,1,2017-03-17,GetLeaflet.do?court_leaflets_id=,936
937,MC100,"Make Sure You Can Pay Your Fine (Kurdish)",mc100-kur.pdf,application/pdf,174696,12/2013,14,2,false,1,2017-03-17,GetLeaflet.do?court_leaflets_id=,937
938,MC100,"Make Sure You Can Pay Your Fine (Portuguese)",mc100-por.pdf,application/pdf,545387,12/2013,16,2,false,1,2017-03-17,GetLeaflet.do?court_leaflets_id=,938
939,MC100,"Make Sure You Can Pay Your Fine (Punjabi)",mc100-pun.pdf,application/pdf,209038,12/2013,17,2,false,1,2017-03-17,GetLeaflet.do?court_leaflets_id=,939
940,MC100,"Make Sure You Can Pay Your Fine (Serbian)",mc100-srp.pdf,application/pdf,545014,12/2013,18,2,false,1,2017-03-17,GetLeaflet.do?court_leaflets_id=,940
941,MC100,"Make Sure You Can Pay Your Fine. (Chinese - Simplified)",mc100-zho.pdf,application/pdf,764766,12/2013,4,2,false,1,2017-03-17,GetLeaflet.do?court_leaflets_id=,941
942,MC100,"Make Sure You Can Pay Your Fine (Spanish)",mc100-spa.pdf,application/pdf,541542,12/2013,20,2,false,1,2017-03-17,GetLeaflet.do?court_leaflets_id=,942
943,MC100,"Make Sure You Can Pay Your Fine. (Chinese - Traditional)",mc100-chi.pdf,application/pdf,891491,12/2013,5,2,false,1,2017-03-17,GetLeaflet.do?court_leaflets_id=,943
944,MC100,"Make Sure You Can Pay Your Fine (Turkish)",mc100-tur.pdf,application/pdf,544674,12/2013,23,2,false,1,2017-03-17,GetLeaflet.do?court_leaflets_id=,944
945,MC100,"Make Sure You Can Pay Your Fine (Urdu)",mc100-urd.pdf,application/pdf,194660,12/2013,24,2,false,1,2017-03-17,GetLeaflet.do?court_leaflets_id=,945
946,EX375,"European Enforcement Order",ex375-eng.pdf,application/pdf,152891,04/2014,8,2,false,1,2017-03-17,GetLeaflet.do?court_leaflets_id=,946
947,EX710,"Can I Talk About My Case Outside Court?  A Guide for Family Court Users",ex710-eng.pdf,application/pdf,216966,07/2013,8,4,false,1,2017-03-17,GetLeaflet.do?court_leaflets_id=,947
948,N119A,"Canllawiau ar gyfer llenwi manylion y ffurflen hawlio (adeilad preswyl ar rent) | Notes for guidance on completing particulars of claim form (Rented residential premises)",n119a-bil.pdf,application/pdf,98095,10/2005,26,4,false,1,2017-03-17,GetLeaflet.do?court_leaflets_id=,948
949,A50 Notes,"Application for a Placement Order (Form A50) - Notes on completing the form",a050-notes-eng.pdf,application/pdf,133430,04/2014,8,3,false,1,2017-03-17,GetLeaflet.do?court_leaflets_id=,949
950,A51 Notes,"Application for variation of a placement order (Form A51) - Notes on completing the form",a051-notes-eng.pdf,application/pdf,107004,04/2014,8,3,false,1,2017-03-17,GetLeaflet.do?court_leaflets_id=,950
951,A52 Notes,"Application for Revocation of a Placement Order (Form 52) - Notes on Completing the Form",a052-notes-eng.pdf,application/pdf,110051,04/2014,8,3,false,1,2017-03-17,GetLeaflet.do?court_leaflets_id=,951
952,A53 Notes,"Application for a Contact Order (Section 26 of the Adoption and Children Act 2002 or an order under section 51A of the Act) (Form A53). Notes on completing the form",a53-notes-eng.pdf,application/pdf,115201,11/2016,8,3,false,1,2017-03-17,GetLeaflet.do?court_leaflets_id=,952
953,A54 Notes,"Application for variation or revocation of a Contact Order (Section 27(1)(b) or Section 51B(1)(c) of the Adoption and Children Act 2002) (Form A54). Notes on completing the form",a54-notes-eng.pdf,application/pdf,214465,11/2016,8,3,false,1,2017-03-17,GetLeaflet.do?court_leaflets_id=,953
954,A55 Notes,"Application for permission to change a child's surname (Form A55). Notes on completing the form",a55-notes-eng.pdf,application/pdf,214257,11/2016,8,3,false,1,2017-03-17,GetLeaflet.do?court_leaflets_id=,954
955,A56 Notes,"Application for permission to remove a child from the United Kingdom (Form A56). Notes on completing the form",a56-notes-eng.pdf,application/pdf,219398,11/2016,8,3,false,1,2017-03-17,GetLeaflet.do?court_leaflets_id=,955
956,A57 Notes,"Application for a Recovery Order (Form A57). Notes on completing the form",a57-notes-eng.pdf,application/pdf,229525,11/2016,8,3,false,1,2017-03-17,GetLeaflet.do?court_leaflets_id=,956
957,A58 Notes,"Application for an Adoption Order (Form A58). Notes on completing the form",a58-notes-eng.pdf,application/pdf,277877,11/2016,8,3,false,1,2017-03-17,GetLeaflet.do?court_leaflets_id=,957
958,A59 Notes,"Application for a Convention Adoption Order (Form A59). Notes on completing the form",a59-notes-eng.pdf,application/pdf,266801,11/2016,8,3,false,1,2017-03-17,GetLeaflet.do?court_leaflets_id=,958
959,A60 Notes,"Application for an Adoption Order (excluding a Convention adoption order) where the child is habitually resident outside the British islands and is brought into the United Kingdom for the purposes of adoption (Form A60). Notes on completing the form",a60-notes-eng.pdf,application/pdf,266990,11/2016,8,3,false,1,2017-03-17,GetLeaflet.do?court_leaflets_id=,959
960,A61 Notes,"Application for an order for parental responsibilty prior to adoption abroad (Form A61). Notes on completing the form",a61-notes-eng.pdf,application/pdf,278515,11/2016,8,3,false,1,2017-03-17,GetLeaflet.do?court_leaflets_id=,960
961,A62 Notes,"Application for a Direction under Section 88(1) of the Adoption and Children Act 2002 (Form A62) ? Notes on Completing the Form",a062-notes-eng.pdf,application/pdf,112556,04/2014,8,3,false,1,2017-03-17,GetLeaflet.do?court_leaflets_id=,961
962,A63 Notes,"Application for an Order to Annul a Convention Adoption or Convention Adoption Order or for an Overseas Adoption or Determination Under Section 91 to Cease to be Valid (Form A63) - Notes on Completing the Form",a063-notes-eng.pdf,application/pdf,105923,04/2014,8,3,false,1,2017-03-17,GetLeaflet.do?court_leaflets_id=,962
963,FP1A,"Application Under Part 19 of the Family Procedure Rules 2010 - Notes for Applicant on Completing the Application (Form FP1)",fp001a-eng.pdf,application/pdf,485457,04/2011,8,3,false,1,2017-03-17,GetLeaflet.do?court_leaflets_id=,963
964,FP1B,"Application Under Part 19 of the Family Procedure 2010 - Notes for Respondent",fp001b-eng.pdf,application/pdf,484575,04/2011,8,3,false,1,2017-03-17,GetLeaflet.do?court_leaflets_id=,964
965,CB4,"Special Guardianship - A Guide for Family Court Users",cb004-eng.pdf,application/pdf,313059,04/2014,8,4,false,1,2017-03-17,GetLeaflet.do?court_leaflets_id=,965
966,D193,"Ynghylch diddymu",d193-cym.pdf,application/pdf,136546,08/2007,25,1,false,1,2017-03-17,W_GetForm.do?court_forms_id=,966
967,D194,"Rydw i eisiau cael diddymiad - Beth ddylwn ei wneud?",d194-cym.pdf,application/pdf,185759,08/2007,25,1,false,1,2017-03-17,W_GetForm.do?court_forms_id=,967
968,D195,"Plant a diddymu",d195-cym.pdf,application/pdf,149786,08/2007,25,1,false,1,2017-03-17,W_GetForm.do?court_forms_id=,968
969,D196,"Ma'r atebydd wedi ateb fy neiseb",d196-cym.pdf,application/pdf,155807,08/2007,25,1,false,1,2017-03-17,W_GetForm.do?court_forms_id=,969
970,D197,"Mae gen i orchymyn amodol",d197-cym.pdf,application/pdf,142596,08/2007,25,1,false,1,2017-03-17,W_GetForm.do?court_forms_id=,970
973,Form E Notes,"Notes to Financial Statement for a Financial Order or for Financial Relief After an Overseas Divorce or Dissolution etc",form-e-notes-eng.pdf,application/pdf,142559,04/2014,8,3,false,1,2017-03-17,GetLeaflet.do?court_leaflets_id=,973
978,A52 Nodiadau | A52 Notes,"Cais am ddiddymu gorchymyn lleoli (Ffurflen 52). Nodiadau ar lenwi'r ffurflen | Application for revocation of a placement order (Form 52). Notes on completing the form",a052-notes-bil.pdf,application/pdf,199139,04/2011,26,3,false,1,2017-03-17,GetLeaflet.do?court_leaflets_id=,978
979,A55 Nodiadau | A55 Notes,"Cais am ganiat창d i newid cyfenw plentyn (Ffurflen A55)Nodiadau ar lenwi'r ffurflen | Application for permission to change a child's surname (Form A55)Notes on completing the form",a055-notes-bil.pdf,application/pdf,100765,12/2005,26,3,false,1,2017-03-17,GetLeaflet.do?court_leaflets_id=,979
980,A56 Nodiadau | A56 Notes,"Cais am ganiat창d i symud plentyn o'r Deyrnas Unedig (Ffurflen A56) Nodiadau ar lenwi'r ffurflen | Application for permission to remove a child from the United Kingdom (Form A56) Notes on completing the form",a056-notes-bil.pdf,application/pdf,103114,12/2005,26,3,false,1,2017-03-17,GetLeaflet.do?court_leaflets_id=,980
981,A62 Nodiadau | A62 Notes,"Cais am gyfarwyddyd dan adran 88(1) Deddf Mabwysiadu a Phlant 2002 (Ffurflen A62)Nodiadau ar lenwi'r ffurflen | Application for a direction under section 88(1) of the Adoption and Children Act 2002 (Form A62) Notes on completing the form",a062-notes-bil.pdf,application/pdf,98772,12/2005,26,3,false,1,2017-03-17,GetLeaflet.do?court_leaflets_id=,981
983,FP1B,"Cais dan Ran 19 Trefniadaeth Teulu 2010. Nodiadau i atebwyr | Application under Part 19 of the Family Procedure 2010. Notes for respondent",fp001b-bil.pdf,application/pdf,169261,04/2011,26,3,false,1,2017-03-17,GetLeaflet.do?court_leaflets_id=,983
986,A63 Nodiadau | A63 Notes,"Cais am orchymyn i ddirymu mabwysiad dan y Cytundeb neu orchymyn mabwysiadu dan y Cytundeb neu i fabwysiad tramor neu benderfyniad dan adran 91 beidio 창 bod yn ddilys (Ffurflen A63) | Application for an order to annul a Convention adoption or Convention adoption order or for an overseas adoption or determination under section 91 to cease to be valid (Form A63)",a063-notes-bil.pdf,application/pdf,106172,12/2005,26,2,false,1,2017-03-17,GetLeaflet.do?court_leaflets_id=,986
989,N8A,"Hawliad Cyflafareddu - nodiadau i'r hawlydd | Arbitration claim - Notes for the claimant",n008a-bil.pdf,application/pdf,143970,04/2006,26,3,false,1,2017-03-17,GetLeaflet.do?court_leaflets_id=,989
990,Form 201,"Routes of appeal",form-201-eng.pdf,application/pdf,248013,04/2013,8,1,false,1,2017-03-17,GetForm.do?court_forms_id=,990
991,Form 202,"How to appeal to the Court of Appeal",form202-eng.pdf,application/pdf,181480,10/2016,8,1,false,1,2017-03-17,GetForm.do?court_forms_id=,991
993,Form 204,"How to prepare an appeal bundle for the Court of Appeal",form204-eng.pdf,application/pdf,210589,02/2017,8,1,false,1,2017-03-17,GetForm.do?court_forms_id=,993
994,Form 205,"Sources of help for unrepresented appellants",form205-eng-20160115.pdf,application/pdf,335909,12/2015,8,1,false,1,2017-03-17,GetForm.do?court_forms_id=,994
996,Form 56A,"Court of Appeal Mediation Scheme",form-056a-eng.pdf,application/pdf,38013,10/2012,8,1,false,1,2017-03-17,GetForm.do?court_forms_id=,996
997,Form 56B,"Court of Appeal mediation scheme - Form 56A and 56B",form-056b-eng.pdf,application/pdf,38768,10/2012,8,1,false,1,2017-03-17,GetForm.do?court_forms_id=,997
999,A21,"Intercountry adoption and the 1993 Hague Convention",a21-eng.pdf,application/pdf,406191,11/2016,8,2,false,1,2017-03-17,GetLeaflet.do?court_leaflets_id=,999
1000,N86,"Interim Charging Order (CPR Part 73)",n086-eng.pdf,application/pdf,130309,04/2016,8,1,false,1,2017-03-17,GetForm.do?court_forms_id=,1000
1001,Form 206,"Applying for permission to appeal to the Court of Appeal",form206-eng.pdf,application/pdf,160092,10/2016,8,2,false,1,2017-03-17,GetLeaflet.do?court_leaflets_id=,1001
1002,Form 207,"Time limits for appealing to the Court of Appeal",form207-eng.pdf,application/pdf,156394,10/2016,8,2,false,1,2017-03-17,GetLeaflet.do?court_leaflets_id=,1002
1003,A50 Nodiadau | A50 Notes,"Cais am Orchymyn Lleoli (Ffurflen A50) Nodiadau ar lenwi'r ffurflen | Application for a Placement Order (Form A50) Notes on completing the form",a050-notes-bil.pdf,application/pdf,112182,12/2005,26,3,false,1,2017-03-17,GetLeaflet.do?court_leaflets_id=,1003
1004,N87,"Final Charging Order (CPR Part 73)",n087-eng.pdf,application/pdf,126999,04/2016,8,1,false,1,2017-03-17,GetForm.do?court_forms_id=,1004
1005,A53 Nodiadau | A53 Notes,"Cais am orchymyn cyswllt dan adran 26 Deddf Mabwysiadu a Phlant 2002 (Ffurflen A53). Nodiadau ar lenwi'r ffurflen | Application for a contact order under section 26 of the Adoption and Children Act 2002 (Form A53). Notes on completing the form",a053-notes-bil.pdf,application/pdf,203053,04/2011,26,3,false,1,2017-03-17,GetLeaflet.do?court_leaflets_id=,1005
1006,A54 Nodiadau | A54 Notes,"Cais i amrywio neu ddiddymu gorchymyn cyswllt a wnaed dan adran 26 Deddf Mabwysiadu a Phlant 2002 (Ffurflen A54) Nodiadau ar lenwi'r  ffurflen | Application for variation or revocation of a contact order made under section 26 of the Adoption and Children Act 2002 (Form A54) Notes on completing the form",a054-notes-bil.pdf,application/pdf,106074,12/2005,26,3,false,1,2017-03-17,GetLeaflet.do?court_leaflets_id=,1006
1007,D50,"Notice of application under section 17 of the Married Women's Property Act 1882 section 66 of the Civil Partnership Act 2004",d050-eng.pdf,application/pdf,83053,11/2014,8,1,false,1,2017-03-17,GetForm.do?court_forms_id=,1007
1008,D50A,"Notice of proceedings acknowledgement of service under s17 of the Married Women's Property Act 1882 s66 of the Civil Partnership Act 2004",d050a-eng.pdf,application/pdf,355812,04/2012,8,1,false,1,2017-03-17,GetForm.do?court_forms_id=,1008
1009,A59 Nodiadau | A59 Notes,"Cais am orchymyn mabwysiadu dan y Cytundeb (Ffur en A59). Nodiadau ar lenwi'r ffur en | Application for a Convention adoption order (Form A59). Notes on completing the form",a59-notes-bil.pdf,application/pdf,178525,11/2016,26,3,false,1,2017-03-17,GetLeaflet.do?court_leaflets_id=,1009
1011,ADM1,"Claim Form (Admiralty claim in rem)",adm001-eng.pdf,application/pdf,36716,02/2013,8,1,false,1,2017-03-17,GetForm.do?court_forms_id=,1011
1012,ADM10,"Standard Directions to the Admiralty Marshal",adm010-eng.pdf,application/pdf,76524,03/2002,8,1,false,1,2017-03-17,GetForm.do?court_forms_id=,1012
1013,ADM11,"Request for caution against Release",adm011-eng.pdf,application/pdf,67284,03/2002,8,1,false,1,2017-03-17,GetForm.do?court_forms_id=,1013
1014,ADM12,"Request and undertaking for release",adm012-eng.pdf,application/pdf,78074,03/2002,8,1,false,1,2017-03-17,GetForm.do?court_forms_id=,1014
1015,ADM12A,"Request for withdrawal of caution against Release",adm012(a)-eng.pdf,application/pdf,60608,03/2002,8,1,false,1,2017-03-17,GetForm.do?court_forms_id=,1015
1016,ADM13,"Application for judgment in default of filing an acknowledgment of service and/or defence or collision statement of case",adm013-eng.pdf,application/pdf,79248,03/2002,8,1,false,1,2017-03-17,GetForm.do?court_forms_id=,1016
1017,ADM14,"Order for sale of a ship",adm014-eng.pdf,application/pdf,82960,03/2002,8,1,false,1,2017-03-17,GetForm.do?court_forms_id=,1017
1018,ADM15,"Claim Form (Admiralty limitation claim)",adm015-eng.pdf,application/pdf,44583,02/2013,8,1,false,1,2017-03-17,GetForm.do?court_forms_id=,1018
1019,ADM16,"Notice of admission of right of claimant to limit liability",adm016-eng.pdf,application/pdf,71445,03/2002,8,1,false,1,2017-03-17,GetForm.do?court_forms_id=,1019
1020,ADM16A,"Defence to admiralty limitation claim",adm016(a)-eng.pdf,application/pdf,77596,03/2002,8,1,false,1,2017-03-17,GetForm.do?court_forms_id=,1020
1021,AJ26,"Courts Charter - Magistrates' Courts",aj26-eng.pdf,application/pdf,214668,11/2006,8,2,false,1,2017-03-17,GetLeaflet.do?court_leaflets_id=,1021
1022,ADM17,"Application for restricted limitation decree",adm017-eng.pdf,application/pdf,76738,03/2002,8,1,false,1,2017-03-17,GetForm.do?court_forms_id=,1022
1023,ADM17A,"Application for general limitation decree",adm017(a)-eng.pdf,application/pdf,73674,11/2008,8,1,false,1,2017-03-17,GetForm.do?court_forms_id=,1023
1024,ADM18,"Restricted limitation decree",adm018-eng.pdf,application/pdf,83174,03/2002,8,1,false,1,2017-03-17,GetForm.do?court_forms_id=,1024
1025,ADM19,"General limitation decree",adm019-eng.pdf,application/pdf,85293,03/2002,8,1,false,1,2017-03-17,GetForm.do?court_forms_id=,1025
1026,ADM1A,"Claim Form (Admiralty claim)",adm001(a)-eng.pdf,application/pdf,35796,02/2013,8,1,false,1,2017-03-17,GetForm.do?court_forms_id=,1026
1027,ADM2,"Acknowledgment of Service (Admiralty claim)",adm002-eng.pdf,application/pdf,346285,04/2006,8,1,false,1,2017-03-17,GetForm.do?court_forms_id=,1027
1028,ADM20,"Defendant's claim in a limitation claim",adm020-eng.pdf,application/pdf,76562,03/2002,8,1,false,1,2017-03-17,GetForm.do?court_forms_id=,1028
1029,5222A,"Supporting you through Jury Service",5222a-eng.pdf,application/pdf,153457,11/2016,8,2,false,1,2017-03-17,GetLeaflet.do?court_leaflets_id=,1029
1030,ADM3,"Collision statement of case",adm003-eng.pdf,application/pdf,78678,03/2002,8,1,false,1,2017-03-17,GetForm.do?court_forms_id=,1030
1031,ADM4,"Application and undertaking for arrest and custody",adm004-eng.pdf,application/pdf,79032,03/2002,8,1,false,1,2017-03-17,GetForm.do?court_forms_id=,1031
1032,ADM5,"Declaration in support of applicationfor warrant of arrest",adm005-eng.pdf,application/pdf,89824,03/2002,8,1,false,1,2017-03-17,GetForm.do?court_forms_id=,1032
1033,ADM6,"Notice to Consular Officer of intention to apply for warrant of arrest",adm006-eng.pdf,application/pdf,83975,03/2002,8,1,false,1,2017-03-17,GetForm.do?court_forms_id=,1033
1034,ADM7,"Request for caution against arrest",adm007-eng.pdf,application/pdf,74960,11/2008,8,1,false,1,2017-03-17,GetForm.do?court_forms_id=,1034
1035,ADM9,"Warrant of Arrest",adm009-eng.pdf,application/pdf,21958,11/2008,8,1,false,1,2017-03-17,GetForm.do?court_forms_id=,1035
1037,EX660 Notes,"Communicating with the Home Office in Family Proceedings",ex660-notes-eng.pdf,application/pdf,126215,10/2014,8,2,false,1,2017-03-17,GetLeaflet.do?court_leaflets_id=,1037
1038,FL701,"Forced Marriage Protection Orders - How can they protect me?",fl701-eng.pdf,application/pdf,168241,07/2015,8,2,false,1,2017-03-17,GetLeaflet.do?court_leaflets_id=,1038
1040,EX711,"A yw'r cyfryngau'n cael bod yn bresennol yn fy achos llys?",ex711-cym.pdf,application/pdf,194439,04/2014,25,2,false,1,2017-03-17,W_GetLeaflet.do?court_leaflets_id=,1040
1041,EX715,"Datrys anghydfodau teuluol heb fynd i'r llys",ex715-cym.pdf,application/pdf,512915,08/2009,25,2,false,1,2017-03-17,W_GetLeaflet.do?court_leaflets_id=,1041
1042,Control Order,"Claim form (under Section 11)",co-claim-eng.doc,application/msword,67072,05/2005,8,1,false,1,2017-03-17,GetForm.do?court_forms_id=,1042
1044,N344,"Request for Warrant of Committal (Judgment summons)",n344-eng.pdf,application/pdf,154038,03/2002,8,1,false,1,2017-03-17,GetForm.do?court_forms_id=,1044
1045,CB5,"Applications Related to Enforcement of a Child Arrangements Order",cb005-eng.pdf,application/pdf,218717,11/2014,8,2,false,1,2017-03-17,GetLeaflet.do?court_leaflets_id=,1045
1046,CB6,"A guide to explain some words and expressions used in private children cases",cb006-eng.pdf,application/pdf,595648,07/2015,8,4,false,1,2017-03-17,GetLeaflet.do?court_leaflets_id=,1046
1048,EX725,"Making a Cross Border Claim in the EU",ex725-eng.pdf,application/pdf,196658,04/2014,8,2,false,1,2017-03-17,GetLeaflet.do?court_leaflets_id=,1048
1060,N500,"Claim form (Directors disqualification proceedings)",n500-eng.pdf,application/pdf,115772,05/2014,8,1,false,1,2017-03-17,GetForm.do?court_forms_id=,1060
1063,N501,"Claim form (Directors disqualification proceedings Section 8A application)",n501-eng.pdf,application/pdf,195669,06/2005,8,1,false,1,2017-03-17,GetForm.do?court_forms_id=,1063
1066,N502,"Acknowledgment of service (Part 8)",n502-eng.pdf,application/pdf,201611,06/2005,8,1,false,1,2017-03-17,GetForm.do?court_forms_id=,1066
1067,N503,"Acknowledgment of service (Part 8) Section 8A applications",n503-eng.pdf,application/pdf,182465,06/2005,8,1,false,1,2017-03-17,GetForm.do?court_forms_id=,1067
1068,N504,"Pre-trial checklist (Directors disqualification)",n504-eng.pdf,application/pdf,408552,06/2005,8,1,false,1,2017-03-17,GetForm.do?court_forms_id=,1068
1069,N164,"Appellant's notice (Small claims track only)",n164-eng.pdf,application/pdf,250413,06/2016,8,1,false,1,2017-03-17,GetForm.do?court_forms_id=,1069
1070,N219,"Application for European Enforcement Order Certificate (Judgment by agreement/admission/settlement)",n219-eng.pdf,application/pdf,317289,10/2005,8,1,false,1,2017-03-17,GetForm.do?court_forms_id=,1070
1071,N219A,"Application for European Enforcement Certificate (Judgment in default of a defence or objection)",n219a-eng.pdf,application/pdf,382676,10/2005,8,1,false,1,2017-03-17,GetForm.do?court_forms_id=,1071
1072,N164,"Hysbysiad apelydd (Trac Hawliadau Bychain yn unig) | Appellant's notice (Small Claims Track only)",n164-bil.pdf,application/pdf,138048,06/2016,26,1,false,1,2017-03-17,GetForm.do?court_forms_id=,1072
1073,EX107 Info,"Guidance, transcription panel list and prices",ex107-info-eng.pdf,application/pdf,253192,03/2017,8,4,false,1,2017-03-17,GetLeaflet.do?court_leaflets_id=,1073
1074,A50,"Application for a placement order (Section 22 Adoption and Children Act 2002)",a050-eng.pdf,application/pdf,616096,11/2014,8,1,false,1,2017-03-17,GetForm.do?court_forms_id=,1074
1075,A51,"Application for variation of a placement order (Section 23 Adoption and Children Act 2002)",a051-eng.pdf,application/pdf,617447,11/2014,8,1,false,1,2017-03-17,GetForm.do?court_forms_id=,1075
1076,A52,"Application for Revocation of a Placement Order - Section 24 Adoption and Children Act 2002",a052-eng.pdf,application/pdf,323721,11/2014,8,1,false,1,2017-03-17,GetForm.do?court_forms_id=,1076
1077,A53,"Application for a Contact Order (Section 26 Adoption and Children Act 2002 or an order for contact or prohibiting contact under section 51A of the Adoption and Children Act 2002)",a53-eng.pdf,application/pdf,612020,11/2016,8,1,false,1,2017-03-17,GetForm.do?court_forms_id=,1077
1078,A54,"Application for variation or revocation of a Contact Order (Section 27(1)(b) or Section 51B(1)(c) Adoption and Children Act 2002)",a54-eng.pdf,application/pdf,317093,11/2016,8,1,false,1,2017-03-17,GetForm.do?court_forms_id=,1078
1079,A55,"Application for permission to change a child's surname (Section 28 Adoption and Children Act 2002)",a55-eng.pdf,application/pdf,340449,11/2016,8,1,false,1,2017-03-17,GetForm.do?court_forms_id=,1079
1080,A56,"Application for permission to remove a child from the United Kingdom (Section 28 Adoption and Children Act 2002)",a56-eng.pdf,application/pdf,346384,11/2016,8,1,false,1,2017-03-17,GetForm.do?court_forms_id=,1080
1081,A57,"Application for a Recovery Order (Section 41 Adoption and Children Act 2002)",a57-eng.pdf,application/pdf,340420,11/2016,8,1,false,1,2017-03-17,GetForm.do?court_forms_id=,1081
