id,code,title,attachment_file_name,attachment_content_type,attachment_file_size,content_date,language_id,doc_attachment_type_id,inactive,creator_id,published_date,original_url,original_id
4501,Criminal Injuries Compensation Scheme 2001,"The Criminal Injuries Compensation Scheme 2001",cic-scheme-2001-eng.pdf,application/pdf,136973,04/2001,8,2,false,1,2017-03-17,GetLeaflet.do?court_leaflets_id=,4501
4502,Criminal Injuries Compensation Scheme 2008,"The Criminal Injuries Compensation Scheme 2008",cic-scheme-2008-eng.pdf,application/pdf,1098260,07/2014,8,2,false,1,2017-03-17,GetLeaflet.do?court_leaflets_id=,4502
4503,Criminal Injuries Compensation Scheme 2012,"The Criminal Injuries Compensation Scheme 2012",cic-scheme-2012-eng.pdf,application/pdf,721490,07/2014,8,2,false,1,2017-03-17,GetLeaflet.do?court_leaflets_id=,4503
4504,CS01,"Memorandum of understanding between Ofsted and the First-Tier Tribunal of the Health, Education and Social Care Chamber",cs001-eng.pdf,application/pdf,73971,04/2014,8,2,false,1,2017-03-17,GetLeaflet.do?court_leaflets_id=,4504
4505,CS02,"Memorandum of Understanding Between Department for Education (Independent Education and Boarding Team) and HM Courts & Tribunals Service (First-tier Tribunal Health, Education and Social Care Chamber)",cs002-eng.pdf,application/pdf,56234,08/2015,8,2,false,1,2017-03-17,GetLeaflet.do?court_leaflets_id=,4505
4506,CS03,"Memorandum of Understanding between Care Quality Commission and HM Courts & Tribunals Service regrading expedited appeals to the First-tier Tribunal (Care Standards)",cs003-eng.pdf,application/pdf,50217,07/2014,8,2,false,1,2017-03-17,GetLeaflet.do?court_leaflets_id=,4506
4507,CS04,"Memorandum of Understanding Between the Welsh Ministers and Tribunals Service in Respect of Expedited Appeals",cs004-eng.pdf,application/pdf,82624,07/2014,8,2,false,1,2017-03-17,GetLeaflet.do?court_leaflets_id=,4507
4508,PHL Guide,"A guide to Making an Appeal to Primary Health Lists",phl-guide-eng.pdf,application/pdf,297645,10/2014,8,4,false,1,2017-03-17,GetLeaflet.do?court_leaflets_id=,4508
4509,REMO 11,"Annex C - Application for Establishment of a Decision",remo-011-eng.doc,application/msword,65024,08/2014,8,1,false,1,2017-03-17,GetForm.do?court_forms_id=,4509
4510,REMO 12,"Annex D - Application for Modification of a Decision",remo-012-eng.doc,application/msword,76288,08/2014,8,1,false,1,2017-03-17,GetForm.do?court_forms_id=,4510
4511,REMO 13,"Annex E - Financial Circumstances Form",remo-013-eng.doc,application/msword,242176,08/2014,8,1,false,1,2017-03-17,GetForm.do?court_forms_id=,4511
4512,SEND21,"Mediation Certificate",send021-eng.pdf,application/pdf,70595,09/2014,8,2,false,1,2017-03-17,GetLeaflet.do?court_leaflets_id=,4512
4513,SEND22,"Answering a Claim - A Guide to Responsible Bodies",send022-eng.pdf,application/pdf,189501,08/2014,8,4,false,1,2017-03-17,GetLeaflet.do?court_leaflets_id=,4513
4514,SEND3,"Information About Schools",send003-eng.pdf,application/pdf,67136,07/2014,8,2,false,1,2017-03-17,GetLeaflet.do?court_leaflets_id=,4514
4515,SEND6,"Information for Children and Young People",send006-eng.pdf,application/pdf,463723,07/2014,8,2,false,1,2017-03-17,GetLeaflet.do?court_leaflets_id=,4515
4516,T243,"At Your Hearing",t243-eng.pdf,application/pdf,541665,03/2015,8,2,false,1,2017-03-17,GetLeaflet.do?court_leaflets_id=,4516
4517,T244,"Further Appeal Notes",t244-eng.pdf,application/pdf,531592,03/2015,8,3,false,1,2017-03-17,GetLeaflet.do?court_leaflets_id=,4517
4518,Application for Anonymity,"Application for anonymity guidance notes (IAT)",anonymity-guide-iat-eng.pdf,application/pdf,54910,08/2012,8,4,false,1,2017-03-17,GetLeaflet.do?court_leaflets_id=,4518
4519,IAFT-1 Guide,"A guide to completing IAFT-1 appeal form",iaft001-guide-eng.pdf,application/pdf,378615,09/2015,8,4,false,1,2017-03-17,GetLeaflet.do?court_leaflets_id=,4519
4520,T490,"Gender Recognition Panel Application Process Flowchart",t490-eng.pdf,application/pdf,2193,07/2014,8,2,false,1,2017-03-17,GetLeaflet.do?court_leaflets_id=,4520
4521,T491,"Table of Gender Recognition Schemes in Countries and Territories",t491-eng.pdf,application/pdf,159883,06/2011,8,2,false,1,2017-03-17,GetLeaflet.do?court_leaflets_id=,4521
4522,T492,"Additonal Guidance Issued by the President on the GRA's Medical Requirements",t492-eng.pdf,application/pdf,29787,12/2005,8,4,false,1,2017-03-17,GetLeaflet.do?court_leaflets_id=,4522
4523,T493,"List of specialists in the field of gender dysphoria",t493-eng.pdf,application/pdf,110828,01/2017,8,2,false,1,2017-03-17,GetLeaflet.do?court_leaflets_id=,4523
4524,T494,"Expenses and Allowances Payable to Parties and Witnesses Attending an Employment Tribunal",t494-eng.pdf,application/pdf,31709,10/2006,8,2,false,1,2017-03-17,GetLeaflet.do?court_leaflets_id=,4524
4525,T622,"Bail Variation Request Form (SIAC B2)",t622-eng.pdf,application/pdf,470083,07/2015,8,1,false,1,2017-03-17,GetForm.do?court_forms_id=,4525
4526,T496,"Guide to loss of earnings and special expenses",t496-eng.pdf,application/pdf,36233,08/2010,8,4,false,1,2017-03-17,GetLeaflet.do?court_leaflets_id=,4526
4527,T497,"Criminal Injuries Compensation (Your appeal)",t497-eng.pdf,application/pdf,147809,07/2014,8,2,false,1,2017-03-17,GetLeaflet.do?court_leaflets_id=,4527
4529,IAFT-3 Guide,"A guide to completing IAFT-3 appeal form",iaft003-guide-eng.pdf,application/pdf,361337,09/2015,8,4,false,1,2017-03-17,GetLeaflet.do?court_leaflets_id=,4529
4530,IAFT-4 Guide,"A guide to completing IAFT-4 application form",iaft004-guide-eng.pdf,application/pdf,165208,09/2015,8,4,false,1,2017-03-17,GetLeaflet.do?court_leaflets_id=,4530
4531,T611,"Judicial Mediation - Scotland",t611-eng.pdf,application/pdf,15405,07/2014,8,2,false,1,2017-03-17,GetLeaflet.do?court_leaflets_id=,4531
4532,T612,"Judicial Mediation - England and Wales",t612-eng.pdf,application/pdf,15040,07/2014,8,2,false,1,2017-03-17,GetLeaflet.do?court_leaflets_id=,4532
4533,IAFT-5 Guide,"A guide to completing IAFT-5 appeal form - Information on fee payment. Notice of appeal to the First-tier Tribunal (Immigration and Asylum Chamber) in country",iaft5-guide-eng.pdf,application/pdf,198723,12/2016,8,4,false,1,2017-03-17,GetLeaflet.do?court_leaflets_id=,4533
4534,T614,"Procedure flowchart for appeals from The First-tier Tribunal (Property Chamber) in England and the Leasehold Valuation and Residential Property Tribunals in Wales",t614-eng.pdf,application/pdf,397255,01/2016,8,2,false,1,2017-03-17,GetLeaflet.do?court_leaflets_id=,4534
4535,T615,"Procedure flowchart for rating appeals",t615-eng.pdf,application/pdf,381077,01/2016,8,2,false,1,2017-03-17,GetLeaflet.do?court_leaflets_id=,4535
4536,T616,"Procedure flowchart for claims for compensation for the compulsory purchase of land and other claims for land compensation",t616-eng.pdf,application/pdf,388115,01/2016,8,2,false,1,2017-03-17,GetLeaflet.do?court_leaflets_id=,4536
4537,T617,"Procedure flowchart for applications to discharge or modify restrictive covenants affecting land",t617-eng.pdf,application/pdf,202926,01/2016,8,2,false,1,2017-03-17,GetLeaflet.do?court_leaflets_id=,4537
4538,T618,"Upper Tribunal Lands Chamber Flowchart - Detailed Assessment of Costs",t618-eng.pdf,application/pdf,52655,11/2010,8,2,false,1,2017-03-17,GetLeaflet.do?court_leaflets_id=,4538
4539,T619A,"Guidance Notes for Completion of SIAC Appeal Form",t619a-eng.pdf,application/pdf,574728,07/2015,8,4,false,1,2017-03-17,GetLeaflet.do?court_leaflets_id=,4539
4540,T98A,"Rights of appeal",t098a-eng.pdf,application/pdf,27588,11/2014,8,2,false,1,2017-03-17,GetLeaflet.do?court_leaflets_id=,4540
4542,FL701,"Forced Marriage Protection Orders - How can they protect me? (Arabic)",fl701-ara.pdf,application/pdf,554028,02/2015,2,2,false,1,2017-03-17,GetLeaflet.do?court_leaflets_id=,4542
4543,FL701,"Forced Marriage Protection Orders - How can they protect me? (Bengali)",fl701-ben.pdf,application/pdf,401170,02/2015,3,2,false,1,2017-03-17,GetLeaflet.do?court_leaflets_id=,4543
4544,FL701,"Forced Marriage Protection Orders - How can they protect me? (Farsi)",fl701-far.pdf,application/pdf,299571,02/2015,9,2,false,1,2017-03-17,GetLeaflet.do?court_leaflets_id=,4544
4545,FL701,"Forced Marriage Protection Orders - How can they protect me? (Punjabi)",fl701-pun.pdf,application/pdf,655057,02/2015,17,2,false,1,2017-03-17,GetLeaflet.do?court_leaflets_id=,4545
4546,FL701,"Forced Marriage Protection Orders - How can they protect me? (Urdu)",fl701-urd.pdf,application/pdf,233762,02/2015,24,2,false,1,2017-03-17,GetLeaflet.do?court_leaflets_id=,4546
4547,SEND23,"Working document guidance",send23-eng-2016.03.01.pdf,application/pdf,141804,01/2015,8,4,false,1,2017-03-17,GetLeaflet.do?court_leaflets_id=,4547
4549,IAFT-6 Guide,"A guide to completing IAFT-6 appeal form - Information on fee payment - Notice of appeal to the First-Tier Tribunal (Immigration and Asylum Chamber) overseas entry clearance",iaft6-guide-eng.pdf,application/pdf,192098,11/2016,8,4,false,1,2017-03-17,GetLeaflet.do?court_leaflets_id=,4549
4550,T94,"Appealing to the First-tier Tribunal (Transport)",t094-eng.pdf,application/pdf,203924,08/2014,8,2,false,1,2017-03-17,GetLeaflet.do?court_leaflets_id=,4550
4551,SEND25,"How to Appeal a Special Educational Needs and Disability (SEND) Decision",send025-eng.pdf,application/pdf,248991,09/2014,8,2,false,1,2017-03-17,GetLeaflet.do?court_leaflets_id=,4551
4552,T499,"The War Pensions and Armed Forces Compensation Chamber Short Guide",t499-eng.pdf,application/pdf,106430,04/2011,8,4,false,1,2017-03-17,GetLeaflet.do?court_leaflets_id=,4552
4553,T610,"The War Pensions and Armed Forces Compensation FAQ",t610-eng.pdf,application/pdf,44172,10/2008,8,2,false,1,2017-03-17,GetLeaflet.do?court_leaflets_id=,4553
4554,IAFT-7 Guide,"A guide to completing IAFT-7 appeal form - Information on fee payment - Notice of appeal to the First-Tier Tribunal (Immigration and Asylum Chamber) overseas appeal against a decision made inside the UK",iaft7-guide-eng.pdf,application/pdf,240760,11/2016,8,4,false,1,2017-03-17,GetLeaflet.do?court_leaflets_id=,4554
4555,SEND14,"Information About Schools",send014-eng.pdf,application/pdf,240015,08/2014,8,2,false,1,2017-03-17,GetLeaflet.do?court_leaflets_id=,4555
4556,REMO 7 Notes,"Guidance Notes for Completing an Application for Recognition, Declaration of Enforceability or Enforcement of a Decision Relating to Maintenance Obligations",remo007-notes-eng.pdf,application/pdf,229511,09/2014,8,4,false,1,2017-03-17,GetLeaflet.do?court_leaflets_id=,4556
4557,REMO 8 Notes,"Guidance Notes for Completing an Application to Obtain a Maintenance Decision or to Have a Decision Relating to Maintenance Modified",remo008-notes-eng.pdf,application/pdf,147884,08/2014,8,4,false,1,2017-03-17,GetLeaflet.do?court_leaflets_id=,4557
4558,IAUT1 Guide,"A guide to completing IAUT-1 application form",iaut001-guide-eng.pdf,application/pdf,171511,07/2015,8,4,false,1,2017-03-17,GetLeaflet.do?court_leaflets_id=,4558
4577,REMO 20,"A guide to Reciprocal Enforcement of Maintenance Orders",remo020-eng.pdf,application/pdf,540718,06/2015,8,4,false,1,2017-03-17,GetLeaflet.do?court_leaflets_id=,4577
4592,COP42,"Making an application to the Court of Protection",cop42-eng.pdf,application/pdf,251489,12/2013,8,2,false,1,2017-03-17,GetLeaflet.do?court_leaflets_id=,4592
4600,COP44,"Court of Protection fees",cop044-eng.pdf,application/pdf,74743,11/2015,8,2,false,1,2017-03-17,GetLeaflet.do?court_leaflets_id=,4600
4601,PH1,"Application by occupier of a park home on a protected site (other than a transit pitch on a local authority gypsy and traveller site) for an order that the site owner give the occupier a written statement as to the terms of their agreement",ph1-eng.doc,application/msword,131072,01/2017,8,1,false,1,2017-03-17,GetForm.do?court_forms_id=,4601
4602,COP44B,"Guide - Applying for help with Court of Protection fees",cop44b-eng.pdf,application/pdf,454231,04/2016,8,4,false,1,2017-03-17,GetLeaflet.do?court_leaflets_id=,4602
4603,PH3,"Application by occupier of a park home or a park home site owner for a determination of any question arising under the Mobile Homes Act 1983 or agreement to which it applies",ph3-eng.doc,application/msword,158720,01/2017,8,1,false,1,2017-03-17,GetForm.do?court_forms_id=,4603
4604,PH4,"Application by site owner for a determination that having regard to its condition a park home is having a detrimental effect on the amenity of the site",ph4-eng.doc,application/msword,141824,01/2017,8,1,false,1,2017-03-17,GetForm.do?court_forms_id=,4604
4605,PH5,"Application by owner of a park home site for a refusal order preventing the occupier from selling the park home and assigning the agreement to the proposed occupier",ph5-eng.doc,application/msword,160768,01/2017,8,1,false,1,2017-03-17,GetForm.do?court_forms_id=,4605
4606,PH6,"Application by owner of a park home site for a refusal order preventing the occupier from giving the park home and assigning the agreement to a member of the occupier's family",ph6-eng.doc,application/msword,159744,01/2017,8,1,false,1,2017-03-17,GetForm.do?court_forms_id=,4606
4607,PH7,"Application by site owner for a determination that the owner may require an occupier to re-site the occupier's home temporarily to another pitch on the protected site",ph7-eng.doc,application/msword,138752,01/2017,8,1,false,1,2017-03-17,GetForm.do?court_forms_id=,4607
4608,PH8,"Application by the occupier for an order that the site owner secure that a temporarily re-sited home is returned to the original pitch",ph8-eng.doc,application/msword,129536,01/2017,8,1,false,1,2017-03-17,GetForm.do?court_forms_id=,4608
4609,PH9,"Application by site owner or occupier for determination of new level of pitch fee",ph9-eng.doc,application/msword,163840,01/2017,8,1,false,1,2017-03-17,GetForm.do?court_forms_id=,4609
4610,PH10,"Application by a protected site owner for a determination that improvements should be taken into account when the pitch fee is reviewed",ph10-eng.doc,application/msword,134144,01/2017,8,1,false,1,2017-03-17,GetForm.do?court_forms_id=,4610
4611,PH11,"Application to the tribunal by a park homes site residents' association for an order recognising the applicant as a qualifying association",ph11-eng.doc,application/msword,137728,01/2017,8,1,false,1,2017-03-17,GetForm.do?court_forms_id=,4611
4612,PH12,"Application by site owner for a determination as to the applicant's entitlement to terminate the agreement",ph12-eng.doc,application/msword,145408,01/2017,8,1,false,1,2017-03-17,GetForm.do?court_forms_id=,4612
4613,PH13,"Application by a local authority site owner for determination of new level of pitch fee",ph13-eng.doc,application/msword,167936,01/2017,8,1,false,1,2017-03-17,GetForm.do?court_forms_id=,4613
4614,PH14,"Application under regulation 17 of the Mobile Homes (Site Rules) (England) Regulations 2014",ph14-eng.doc,application/msword,130560,01/2017,8,1,false,1,2017-03-17,GetForm.do?court_forms_id=,4614
4615,PH15,"Application under regulation 10 of the Mobile Homes (Site Rules) (England) Regulations 2014 ('the 2014 regulations') with regard to the proposed making, varying or deletion of a site rule or rules",ph15-eng.doc,application/msword,147968,01/2017,8,1,false,1,2017-03-17,GetForm.do?court_forms_id=,4615
4616,PH16,"Application under regulation 6 of the Mobile Homes (Site Licensing) (England) Regulations 2014 ('the 2014 regulations') with regard to the local authority's refusal to issue, or consent to the transfer of, a site licence",ph16-eng.doc,application/msword,132608,01/2017,8,1,false,1,2017-03-17,GetForm.do?court_forms_id=,4616
4617,PH17,"Application by a local authority under Section 5A(3) of the Caravan Sites and Control of Development Act 1960 (as amended) ('the Act') for an order as to payment of the annual site licence fee by the licence holder ('a payment order') OR an order for revocation of the site licence on the ground of non-compliance with a payment order",ph17-eng.doc,application/msword,133632,01/2017,8,1,false,1,2017-03-17,GetForm.do?court_forms_id=,4617
4618,PH18,"Appeal under Section 7 or 8 of the Caravan Sites and Control of Development Act 1960 (as amended) ('the Act') (1) with regard to conditions attached to a site licence or (2) to an alteration by the local authority of conditions attached to a licence",ph18-eng.doc,application/msword,142336,01/2017,8,1,false,1,2017-03-17,GetForm.do?court_forms_id=,4618
4619,PH19,"Appeal under the Caravan Sites and Control of Development Act 1960 (as amended) ('the Act') against: (1) a compliance notice served by a local authority under Section 9A of the Act with regard to an alleged breach of condition(s) attached to a site licence, or (2) the taking of emergency action by the local authority under Section 9E of the Act, or (3) the demand by a local authority for a charge under Section 9F of the Act in respect of action in default or emergency action",ph19-eng.doc,application/msword,144384,01/2017,8,1,false,1,2017-03-17,GetForm.do?court_forms_id=,4619
4630,Form 200,"Civil Appeals Office fees (from 18 April 2016)",form-200-eng.pdf,application/pdf,89134,04/2016,8,1,false,1,2017-03-17,GetForm.do?court_forms_id=,989
4635,LOC014,"Court fees for bankrupts",loc014-eng.pdf,application/pdf,144500,12/2008,8,1,false,1,2017-03-17,GetForm.do?court_forms_id=,4635
4640,Form 56C,"Court of Appeal Mediation Scheme - Fees Schedule",form-056c-eng.pdf,application/pdf,13988,10/2012,8,1,false,1,2017-03-17,GetForm.do?court_forms_id=,4640
4645,Gambling - Application for fee remission for companies,"Application for fee remission for companies",gambling-fee-exemption(company)-eng.pdf,application/pdf,20968,01/2010,8,1,false,1,2017-03-17,GetForm.do?court_forms_id=,4645
4650,EX504,"Graduated Fees Reference to a Judge",ex504-eng.pdf,application/pdf,383396,08/2009,8,1,false,1,2017-03-17,GetForm.do?court_forms_id=,4650
4660,UTLC Fees,"Upper Tribunal (Lands Chamber) fees table (from 18 April 2016)",utlc-fees-eng.pdf,application/pdf,73795,11/2016,8,2,false,1,2017-03-17,GetLeaflet.do?court_leaflets_id=,4660
4724,SEND24,"EHC appeal form - child of or under statutory school age",send24-eng-2016.03.30.pdf,application/pdf,599191,02/2016,8,1,false,1,2017-03-17,GetForm.do?court_forms_id=,4724
4725,SEND24A,"EHC appeal form - young person over statutory school age",send024a-eng.pdf,application/pdf,223063,06/2015,8,1,false,1,2017-03-17,GetForm.do?court_forms_id=,4725
4726,SEND4B,"Disability Discrimination Claim by Young Person",send004b-eng.pdf,application/pdf,166358,09/2015,8,1,false,1,2017-03-17,GetForm.do?court_forms_id=,4726
4727,SEND26A,"Disability discrimination claim after permanent exclusion - parent",send026a-eng.pdf,application/pdf,199651,09/2015,8,1,false,1,2017-03-17,GetForm.do?court_forms_id=,4727
4728,SEND26B,"Disability discrimination claim after permanent exclusion - young person",send026b-eng.pdf,application/pdf,177797,09/2015,8,1,false,1,2017-03-17,GetForm.do?court_forms_id=,4728
4729,SEND28,"Appeal form - child detained in youth accommodation",send28-eng-2016.03.01.pdf,application/pdf,130042,02/2016,8,1,false,1,2017-03-17,GetForm.do?court_forms_id=,4729
4730,SEND28A,"Appeal form - young person under 18 detained in youth accommodation",send28a-eng-2016.03.01.pdf,application/pdf,221712,02/2016,8,1,false,1,2017-03-17,GetForm.do?court_forms_id=,4730
4733,SEND 30,"Request for a Witness Summons",send030-eng.pdf,application/pdf,77852,07/2015,8,1,false,1,2017-03-17,GetForm.do?court_forms_id=,4733
4734,EXN161,"Appellant's notice - Application for Permission to Appeal Under Sections 26, 28, 103, 105, 108 and 110 of the Extradition Act 2003",exn161-eng.doc,application/msword,62464,10/2014,8,1,false,1,2017-03-17,GetForm.do?court_forms_id=,4734
4735,EXN162,"Respondent's notice - To an Application for Permission to Appeal Under Sections 26, 28, 103, 105, 108 and 110 of the Extradition Act 2003",exn162-eng.doc,application/msword,55808,10/2014,8,1,false,1,2017-03-17,GetForm.do?court_forms_id=,4735
4736,EX244,"Application Notice - (Pursuant to the Extradition Act 2003)",ex244-eng.doc,application/msword,36864,10/2014,8,1,false,1,2017-03-17,GetForm.do?court_forms_id=,4736
4737,SEND24B,"Appeal form - refusal to secure an EHC assessment - child of or under statutory school age",send24b-eng.pdf,application/pdf,235511,08/2016,8,1,false,1,2017-03-17,GetForm.do?court_forms_id=,4737
4738,EX160A,"Sut i wneud cais am help i dalu ffioedd | How to apply for help with fees",ex160a-bil.pdf,application/pdf,193900,02/2017,26,2,false,1,2017-03-17,GetLeaflet.do?court_leaflets_id=,4738
4750,REMO 7,"Application Form With a View to the Recognition, Declaration of Enforceability or Enforcement of a Decision in Matters Relating to Maintenance Obligations",remo007-eng.pdf,application/pdf,119793,10/2014,8,1,false,1,2017-03-17,GetForm.do?court_forms_id=,4750
4751,REMO 8,"Application Form to Obtain or Have Modified a Decision in Matters Relating to Maintenance Obligations",remo008-eng.pdf,application/pdf,132901,10/2014,8,1,false,1,2017-03-17,GetForm.do?court_forms_id=,4751
4752,UT3 Notes,"Notes for Appellants Form UT3 (Mental Health)",ut003-notes-eng.pdf,application/pdf,39430,11/2009,8,3,false,1,2017-03-17,GetLeaflet.do?court_leaflets_id=,4752
4753,UT3 Leaflet,"Appealing Against a Decision of the Health, Education and Social Care Chamber of the First-tier Tribunal (Mental Health) (Appeals from Decisions of the First-tier Tribunal)",ut003-leaflet-eng.pdf,application/pdf,111679,04/2013,8,2,false,1,2017-03-17,GetLeaflet.do?court_leaflets_id=,4753
4754,UT3 Leaflet,"Appealing Against a Decision of the Health, Education and Social Care Chamber of the First-tier Tribunal (Mental Health) (Appeals from Decisions of the First-tier Tribunal)",ut003-leaflet-eng.doc,application/msword,1787904,03/2013,8,2,false,1,2017-03-17,GetLeaflet.do?court_leaflets_id=,4754
4755,UT4 Notes,"Notes for Appellants Form UT4 (Special Educational Needs and Disability Discrimination in Schools)",ut004-notes-eng.pdf,application/pdf,34204,10/2011,8,3,false,1,2017-03-17,GetLeaflet.do?court_leaflets_id=,4755
4756,UT4 Leaflet,"Appealing Against a Decision of the Health, Education and Social Care Chamber of the First-tier Tribunal (Special Educational Needs) (Appeals from Decisions of the First-tier Tribunal)",ut004-leaflet-eng.pdf,application/pdf,67454,04/2014,8,2,false,1,2017-03-17,GetLeaflet.do?court_leaflets_id=,4756
4757,UT5 Notes,"Notes for Applicants and Appellants Form UT5 (Health Education & Social Care Chamber Care Standards and NHS (Performers) List)",ut005-notes-eng.pdf,application/pdf,87807,05/2013,8,3,false,1,2017-03-17,GetLeaflet.do?court_leaflets_id=,4757
4758,UT5 Leaflet,"Appealing to the Upper Tribunal Administrative Appeals Chamber from the First-tier Tribunal. Care Standards and NHS (Performers) List Decisions",ut005-leaflet-eng.pdf,application/pdf,117591,05/2013,8,2,false,1,2017-03-17,GetLeaflet.do?court_leaflets_id=,4758
4759,UT6 Notes,"Notes for Appellants Form UT6 (War Pensions and Armed Forces Compensation)",ut006-notes-eng.pdf,application/pdf,30866,07/2012,8,3,false,1,2017-03-17,GetLeaflet.do?court_leaflets_id=,4759
4760,UT6 Notes,"Notes for Appellants Form UT6 (War Pensions and Armed Forces Compensation)",ut006-notes-eng.doc,application/msword,54272,07/2012,8,3,false,1,2017-03-17,GetLeaflet.do?court_leaflets_id=,4760
4761,UT6 Leaflet,"Appealing Against a Decision of the War Pensions and Armed Forces Compensation Chamber of the First-tier Tribunal (Appeals from Decisions of the First-tier Tribunal)",ut006-leaflet-eng.pdf,application/pdf,85785,07/2012,8,2,false,1,2017-03-17,GetLeaflet.do?court_leaflets_id=,4761
4762,UT6 Leaflet,"Appealing Against a Decision of the War Pensions and Armed Forces Compensation Chamber of the First-tier Tribunal (Appeals from Decisions of the First-tier Tribunal)",ut006-leaflet-eng.doc,application/msword,1807360,04/2013,8,2,false,1,2017-03-17,GetLeaflet.do?court_leaflets_id=,4762
4763,UT8 Notes,"Notes for Applicants and Appellants form UT8 (Mental Health Wales)",ut008-notes-eng.pdf,application/pdf,320445,04/2012,8,3,false,1,2017-03-17,GetLeaflet.do?court_leaflets_id=,4763
4765,UT8 Leaflet,"Appealing Against a Decision of the Health, Education and Social Care Chamber of the First-tier Tribunal (Mental Health Wales) (Appeals from Decisions of the First-tier Tribunal)",ut008-leaflet-eng.pdf,application/pdf,64029,03/2014,8,2,false,1,2017-03-17,GetLeaflet.do?court_leaflets_id=,4765
4766,UT9 Notes,"Notes for Applicants and Appellants Form UT9 (Appeals from Special Educational Needs Tribunal for Wales)",ut009-notes-eng.pdf,application/pdf,309844,04/2012,8,3,false,1,2017-03-17,GetLeaflet.do?court_leaflets_id=,4766
4767,UT9 Leaflet,"Appealing Against a Decision of the Health, Education and Social Care Chamber of the First-tier Tribunal (Special Educational Needs Wales) (Appeals from Decisions of the First-tier Tribunal)",ut009-leaflet-eng.pdf,application/pdf,107267,05/2009,8,2,false,1,2017-03-17,GetLeaflet.do?court_leaflets_id=,4767
4768,UT10 Leaflet,"Appeals against decisions of the Disclosure and Barring Service (Appeals direct to the Upper Tribunal)",ut10-leaflet-eng.pdf,application/pdf,185000,09/2016,8,2,false,1,2017-03-17,GetLeaflet.do?court_leaflets_id=,4768
4770,UT11 Notes,"Notes for Applicants and Appellants Form UT11 (General Regulatory Chamber)",ut011-notes-eng.pdf,application/pdf,551704,11/2014,8,3,false,1,2017-03-17,GetLeaflet.do?court_leaflets_id=,4770
4771,UT11 Leaflet,"All General Regulatory Chamber Cases Except Information Rights (Appeals from Decisions of the First-tier Tribunal)",ut011-leaflet-eng.pdf,application/pdf,419962,09/2015,8,2,false,1,2017-03-17,GetLeaflet.do?court_leaflets_id=,4771
4772,UT12 Notes,"Notes for appellants form UT12 (Traffic Commissioner) appeals",ut12-notes-eng.pdf,application/pdf,404635,12/2016,8,3,false,1,2017-03-17,GetLeaflet.do?court_leaflets_id=,4772
